{
  "schemaVersion": "3",
  "name": {
    "zh": "测试食材（夹具）"
  },
  "baseUnit": "g",
  "pcsToGram": 50,
  "pcsToGramSource": {
    "kind": "measured",
    "by": "chef",
    "date": "2026-10-19"
  },
  "yield": 0.8,
  "yieldSource": {
    "kind": "rule",
    "ruleId": "test-yield"
  },
  "trackStock": false
}
